{
  "lessonId": "string",
  "subject": "string",
  "level": "string",
  "board": "string",
  "specVersion": "string",
  "curriculumCoverage": {
    "statutory": [
      {
        "authority": "DfE",
        "statementId": "DFE-BIO-KS4-4.1"
      }
    ],
    "examBoard": [
      {
        "board": "AQA",
        "topic": "Photosynthesis",
        "specPoint": "Interpret graphs showing limiting factors"
      }
    ]
  },
  "review": {
    "status": "approved",
    "reviewedBy": {
      "name": "string",
      "role": "teacher",
      "experienceYears": 0
    },
    "reviewedAt": "2025-02-05T12:00:00.000Z"
  },
  "provenance": {
    "aiAssisted": true,
    "humanApproved": true
  }
}
